<?xml version='1.0' encoding='UTF-8'?>
<Civ4GameText xmlns="http://www.firaxis.com" xmlns:xsi="http://www.w3.org/2001/XMLSchema-instance" xsi:schemaLocation="http://www.firaxis.com ../../../Xml/Schema/Civ4Gametext.xsd">
	<TEXT>
		<Tag>TXT_KEY_MISSION_DIPLOMAT_ASSIMULATE_IND_PEOPLE</Tag>
		<English>Assimulate Indigenous Peoples</English>
		<French>Assimiler ces Peuples Indigènes</French>
		<Italian>Assimila la comunità indigena</Italian>
		<Polish>Asimiluj Tubylc&#243;w</Polish>
	</TEXT>
	<TEXT>
		<Tag>TXT_KEY_MISSION_DIPLOMAT_PRAISE_IND_PEOPLE</Tag>
		<English>Assimulate Indigenous Peoples</English>
		<French>Assimiler ces Peuples Indigènes</French>
		<Italian>Celebra la comunità indigena</Italian>
		<Polish>Asimiluj Tubylc&#243;w</Polish>
	</TEXT>
	<TEXT>
		<Tag>TXT_KEY_MISSION_DIPLOMAT_SPEAK_TO_BARBARIAN_LEADERS</Tag>
		<English>Speak with barbarian leaders.</English>
		<French>Parler avec les chefs barbares.</French>
		<Italian>Parla con i leader barbarici.</Italian>
		<Polish>Porozmawiaj z przyw&#243;dcami barbarzy&#241;c&#243;w.</Polish>
	</TEXT>
	<TEXT>
		<Tag>TXT_KEY_MISSION_DIPLOMAT_SPREAD_RELIGION</Tag>
		<English>Spread your State religion to barbarian city.</English>
		<French>Propager votre Religion d'Etat à la cité barbare.</French>
		<Italian>Diffondi la tua religione di stato nella città barbarica.</Italian>
		<Polish>Konwertuj barbarzy&#241;skie miasto do Twojej religii pa&#241;stwowej.</Polish>
	</TEXT>
</Civ4GameText>
