<?xml version='1.0' encoding='UTF-8'?>
<Civ4GameText xmlns="http://www.firaxis.com" xmlns:xsi="http://www.w3.org/2001/XMLSchema-instance" xsi:schemaLocation="http://www.firaxis.com ../../../../../Xml/Schema/Civ4Gametext.xsd">
	<TEXT>
		<Tag>TXT_KEY_UNIT_LARA_CROFT</Tag>
		<English>Lara Croft</English>
		<French>
			<Text>Lara Croft</Text>
			<Gender>Female</Gender>
			<Plural>0</Plural>
		</French>
		<German>
			<Text>Lara Croft</Text>
			<Gender>Female</Gender>
			<Plural>0</Plural>
		</German>
		<Italian>Lara Croft</Italian>
		<Spanish>
			<Text>Lara Croft</Text>
			<Gender>Female</Gender>
			<Plural>0</Plural>
		</Spanish>
		<Russian>Лара Крофт</Russian>
	</TEXT>
	<TEXT>
		<Tag>TXT_KEY_UNIT_LARA_CROFT_PEDIA</Tag>
		<English>The daughter of Lord Henshingly Croft, Lara was brought up in the sheltered world of aristocracy surrounded by tennis, butlers, and corgis. But this all started to change when she went to the renowned school of Gordonstoun and found the mountains of Scotland. Later, at her Swiss finishing school, she took to the art of extreme skiing and spent a holiday in the Himalayas searching for more challenging terrain. On her return trip however, the plane crashed deep within the mountains and Lara was the only survivor. Two weeks later, when she walked into a mountain village, her experiences had a profound effect on her. Unable to stand the suffocating atmosphere of upper-class British society any longer, she realized she was only truly alive when she was travelling alone. Despite this drastic life change, Lara still retains the essence of her upbringing - most notably with her polite, upper-class accent. Lara's parents though, having sported hopes of her marrying the Earl of Farringdon, were less than convinced about this chosen lifestyle and ceased to associate with their daughter - even terminating her monthly allowance. The Earl is still waiting. While in England, Lara lives in a mansion in Surrey which she inherited many years ago. At one time she saw little use in it but now realizes that, if nothing else, it is at least handy for storing all the artifacts she has acquired on her travels. She has also had a custom-built assault course constructed in the grounds for training purposes.</English>
		<German>Lara Croft, Tochter von Lord Henshingly Croft, war von Geburt an ein Kind der Aristokratie. Nachdem sie im Alter von 21 Jahren ihre Schulausbildung abgeschlossen hatte, schien eine Heirat mit einem wohlhabenden Mann schon sicher. Aber auf dem Rückweg von einem Skiausflug stürzte sie mit ihrem Charterflugzeug tief im Herzen des Himalaja Gebirges ab. Als einzige Überlebende lernte Lara, dass es von ihrer Intelligenz abhing, auf welche Weise sie in dieser feindlichen Umgebung, fernab von der schützenden Stätte ihrer Kindheit, überleben würde. Als sie 2 Wochen später im Dorf Tokakeriby eintraf, hatten die zurückliegenden Erfahrungen einen tiefen Eindruck auf sie hinterlassen. Unfähig, noch länger die enge und erstickende Atmosphäre der britischen Oberschicht zu ertragen, wurde sie sich darüber klar, dass sie nur dann wirklich leben würde, wenn sie sich alleine auf Reisen um die Welt begibt. In den nächsten 8 Jahren eignete sie sich ein umfangreiches Wissen über antike Zivilisationen der Erde an. Doch bald darauf schon verstieß die Familie ihre verschwenderische Tochter, so dass sie sich der Schriftstellerei zu wandte, um ihre Reisen zu finanzieren. Sie wurde nicht nur durch die Entdeckungen mehrerer, für die Archäologie äußerst interessanter antiker Stätten berühmt, sondern machte sich außerdem durch die Herausgabe von Reisetagebüchern und detaillierten Protokollen ihrer archäologischen Auswertungen einen Namen.</German>
		<Italian>Figlia di Lord Henshingly Croft, Lara fu cresciuta nel mondo sicuro dell'aristocrazia, circondata da tennis, maggiordomi e cortesie. Tutto ciò iniziò a cambiare quando lei andò alla rinomata scuola di Gordonstoun e scoprì le montagne della Scozia. In seguito, mentre era in una scuola svizzera, apprese l'arte dello sci estremo e trascorse una vacanza in Himalaya, alla ricerca di terreni più impegnativi. Durante il viaggio di ritorno però l'aereo precipitò sulle montagne, e Lara fu l'unica sopravvissuta. Due settimane dopo, quando entrò a piedi in un villaggio di montagna, le sue esperienze avevano avuto un profondo effetto su di lei. Incapace di sopportare l'opprimente atmosfera dell'alta società inglese, capì di essere veramente viva solo quando viaggiava da sola. Nonostante questo drastico cambio di vita, Lara mantiene l'essenza della propria educazione, in particolare il suo accento educato dell'alta società. I genitori di Lara però, avendo sperato che lei sposasse il Duca di Farringdon, non erano convinti di questo stile di vita e tagliarono i contatti con lei, sospendendo il suo vitalizio mensile. Il Duca sta ancora aspettando. Quando è in Inghilterra Lara vive in una villa nel Surrey, che ha ereditato molti anni fa. A un certo punto la riteneva poco utile, ma ora Lara capisce che è utile almeno per conservare tutti gli artefatti che ha recuperato nei suoi viaggi. Si è fatta anche costruire un percorso di guerra personalizzato nel giardino.</Italian>
		<Polish>C&#243;rka lorda Henshingly'ego Crofta. Wychowywana by&#179;a na arystokratk&#234;, zar&#234;czona by&#179;a z fikcyjnym hrabi&#185; Ferringdon. Ucz&#234;szcza&#179;a do szko&#179;y z internatem Gordonstoun w Szwajcarii, tam te&#191; ucz&#234;szcza&#179;a do finishing school. Po katastrofie samolotu w Himalajach samotnie sp&#234;dzi&#179;a dwa tygodnie w g&#243;rach. Wydarzenia te sprawi&#179;y, &#191;e porzuci&#179;a swoje dawne &#191;ycie, a zacz&#234;&#179;a wie&#156;&#230; &#191;ywot podr&#243;&#191;uj&#185;cej po &#156;wiecie poszukiwaczki przyg&#243;d. Na podstawie swoich przyg&#243;d jako najemniczka, my&#156;liwy i mistrzyni z&#179;odziejstwa napisa&#179;a ksi&#185;&#191;ki i inne publikacje. Na potrzeby p&#243;&#159;niejszych gier historia zosta&#179;a zmieniona - w samolocie znajdowa&#179;a si&#234; r&#243;wnie&#191; jej matka. Podczas poszukiwania schronienia Croft by&#179;a &#156;wiadkiem znikni&#234;cia matki, kt&#243;ra dotkn&#234;&#179;a staro&#191;ytnego miecza. Lord Croft zagin&#185;&#179;, poszukuj&#185;c &#191;ony.</Polish>
		<Russian>Дочь лорда Хеншингли Крофта появилась на свет в аристократическом мире, окруженная слугами, общественными событиями и высшим обществом. Но все это начало меняться, когда она попала в Горлонстаунскую школу и открыла для себя горы Шотландии. Позднее, в Швейцарской высшей школе она стала заниматься экстремальной ездой на лыжах, а потом провела выходные в Гималаях, пробуя более сложную местность. Однако, когда она летела назад, самолет разбился где-то в горах и Лара оказалась единственной выжившей. Через две недели она добралась до маленькой деревни в горах. Но опыт этого происшествия оказал на нее решающее влияние. Больше не в силах выносить замкнутую атмосферу высшего британского общества, Лара поняла, что по-настоящему она живет, только когда путешествует в одиночку. Семья Лары, возлагавшая большие надежды на ее женитьбу с Эрлом Фаррингдоном, была более чем возмущена этой переменой и отказалась от всяческих связей с ней. Лара живет в Англии, в своем особняке в Суррее, который унаследовала много лет назад. Поначалу она не видела в нем большой пользы, но потом поняла, что, по крайней мере, в нем можно хранить свои трофеи. На территории особняка у нее имеется построенная по заказу тренировочная полоса препятствий.</Russian>
	</TEXT>
</Civ4GameText>
