<?xml version='1.0' encoding='UTF-8'?>
<Civ4GameText xmlns="http://www.firaxis.com" xmlns:xsi="http://www.w3.org/2001/XMLSchema-instance" xsi:schemaLocation="http://www.firaxis.com ../Schema/Civ4Gametext.xsd">
	<TEXT>
		<Tag>TXT_KEY_BUILDING_TRADITION_ARCHERY</Tag>
		<English>Tradition - Archery</English>
		<French>Tradition - Archerie</French>
		<German>Tradition - Bogenschießen</German>
		<Italian>Tradizione del tiro con l'arco</Italian>
		<Russian>Традиция - Лучники</Russian>
	</TEXT>
	<TEXT>
		<Tag>TXT_KEY_BUILDING_EFFECT_TRADITION_ARCHERY</Tag>
		<English>Effect - Tradition - Archery</English>
		<French>Effect (Tradition - Archerie)</French>
		<German>Effekt (Tradition - Bogenschießen)</German>
		<Italian>Effetto della tradizione del tiro con l'arco</Italian>
		<Russian>Эффект - Традиция - Лучники</Russian>
	</TEXT>
	<TEXT>
		<Tag>TXT_KEY_BUILDING_EFFECT_TRADITION_ARCHERY_PEDIA</Tag>
		<English>Archers are improved.</English>
		<French>Les Archers sont améliorés.</French>
		<German>Bogenschützen sind verbessert.</German>
		<Italian>Le unità arciere sono state migliorate.</Italian>
		<Russian>Лучники улучшены.</Russian>
	</TEXT>
	<TEXT>
		<Tag>TXT_KEY_BUILDING_TRADITION_ARCHERY_PEDIA</Tag>
		<English>Archery is encouraged in your nation.</English>
		<French>L'Archerie est encouragée dans votre nation.</French>
		<German>Bogenschießen wird im Land gefördert.</German>
		<Italian>Il tiro con l'arco è incoraggiato nella tua nazione.</Italian>
		<Russian>Стрельба из лука поощряется в вашей стране.</Russian>
	</TEXT>
	<TEXT>
		<Tag>TXT_KEY_BUILDING_TRADITION_AESTHETIC_APPRECIATION</Tag>
		<English>Tradition - Aesthetic Appreciation</English>
		<French>Tradition (Appréciation esthétique)</French>
		<German>Tradition - Ästhetische Würdigung</German>
		<Italian>Tradizione dell'apprezzamento estetico</Italian>
		<Russian>Традиция - Эстетическая Оценка</Russian>
	</TEXT>
	<TEXT>
		<Tag>TXT_KEY_BUILDING_EFFECT_TRADITION_AESTHETIC_APPRECIATION</Tag>
		<English>Effect - Tradition - Aesthetic Appreciation</English>
		<French>Effet - Tradition (Appréciation esthétique)</French>
		<German>Effekt - Tradition - Ästhetische Würdigung</German>
		<Italian>Effetto della tradizione sull'apprezzamento estetico</Italian>
		<Russian>Эффект - Традиция - Эстетическая Оценка</Russian>
	</TEXT>
	<TEXT>
		<Tag>TXT_KEY_BUILDING_TRADITION_AESTHETIC_APPRECIATION_PEDIA</Tag>
		<English>Aesthetic appreciation is commonly referred to as the appreciation of beauty and excellence, defined by Peterson and Seligman as the ability to find, recognize, and take pleasure in goodness in the physical and social worlds.</English>
		<French>L'appréciation esthétique est communément désignée comme l'appréciation de la beauté et de l'excellence, définie par Peterson et Seligman comme la capacité à trouver, reconnaître et prendre plaisir à la bonté dans les mondes physique et social.</French>
		<German>Ästhetische Würdigung ist die allgemeine Wertschätzung von Schönheit und Perfektion. Peterson und Seligman definieren sie als Fähigkeit, Ästhetik zu finden, zu erkennen und sich an ihr zu erfreuen, sowohl im physischen wie im sozialen Umfeld.</German>
		<Italian>L'apprezzamento estetico è comunemente indicato come l'apprezzamento della bellezza e dell'eccellenza, definito da Peterson e Seligman come la capacità di trovare, riconoscere e trarre piacere dalla bellezza nel mondo fisico e sociale.</Italian>
		<Russian>Эстетическая оценка обычно называется оценкой красоты и совершенства, определяемой Петерсоном и Селигманом как способность находить, распознавать и получать удовольствие от добра в физическом и социальном мирах.</Russian>
	</TEXT>
	<TEXT>
		<Tag>TXT_KEY_BUILDING_TRADITION_WORK_ETHIC</Tag>
		<English>Tradition - Work Ethic</English>
		<French>Tradition - Éthique du Travail</French>
		<German>Tradition - Arbeitsmoral</German>
		<Italian>Tradizione dell'etica del lavoro</Italian>
		<Russian>Традиция - Трудовая Этика</Russian>
	</TEXT>
	<TEXT>
		<Tag>TXT_KEY_BUILDING_EFFECT_TRADITION_WORK_ETHIC</Tag>
		<English>Effect - Tradition - Work Ethic</English>
		<French>Effet (Tradition - Éthique du Travail)</French>
		<German>Effekt - Tradition - Arbeitsmoral</German>
		<Italian>Effetto della tradizione dell'etica del lavoro</Italian>
		<Russian>Эффект - Традиция - Трудовая Этика</Russian>
	</TEXT>
	<TEXT>
		<Tag>TXT_KEY_BUILDING_TRADITION_WORK_ETHIC_PEDIA</Tag>
		<English>Work ethic is a value based on hard work and diligence.</English>
		<French>L'Éthique du travail est une valeur basée sur la diligence et le labeur.</French>
		<German>Arbeitsmoral basiert auf Fleiß und harter Arbeit.</German>
		<Italian>L'etica del lavoro è un valore basato sul duro lavoro e sulla diligenza.</Italian>
		<Russian>Трудовая этика - ценность, основанная на тяжелом труде и прилежании.</Russian>
	</TEXT>
	<TEXT>
		<Tag>TXT_KEY_PROMOTION_ARCHER_TRADITION</Tag>
		<English>Archer Tradition</English>
		<French>Tradition des Archers</French>
		<German>Tradition des Bogenschießens</German>
		<Italian>Tiro con l'arco tradizionale</Italian>
		<Russian>Опытный лучник</Russian>
	</TEXT>
	<TEXT>
		<Tag>TXT_KEY_PROMOTION_TRADITION_ASTHETIC_APPRECIATION</Tag>
		<English>Aesthetic Appreciation</English>
		<French>Appréciation esthétique</French>
		<German>Ästhetische Würdigung</German>
		<Italian>Apprezzamento estetico</Italian>
		<Russian>Эстетическая Оценка</Russian>
	</TEXT>
	<TEXT>
		<Tag>TXT_KEY_PROMOTION_TRADITION_WORK_ETHIC</Tag>
		<English>Work Ethic</English>
		<French>Éthique du Travail</French>
		<German>Arbeitsmoral</German>
		<Italian>Etica del lavoro</Italian>
		<Russian>Трудовая Этика</Russian>
	</TEXT>
</Civ4GameText>
