<?xml version='1.0' encoding='UTF-8'?>
<!-- Composite texts: Those TXT keys are enumerated by DLL and Python. Used to select language. -->
<Civ4GameText xmlns="http://www.firaxis.com" xmlns:xsi="http://www.w3.org/2001/XMLSchema-instance" xsi:schemaLocation="http://www.firaxis.com ../../Schema/Civ4Gametext.xsd">
	<TEXT>
		<Tag>TXT_KEY_LANGUAGE_0</Tag>
		<English>English</English>
		<French>Anglais</French>
		<German>English</German>
		<Italian>Inglese</Italian>
		<Spanish>Inglés</Spanish>
		<Polish>Angielski</Polish>
		<Russian>Английский</Russian>
	</TEXT>
	<TEXT>
		<Tag>TXT_KEY_LANGUAGE_1</Tag>
		<English>French</English>
		<French>Français</French>
		<German>Français</German>
		<Italian>Francese</Italian>
		<Spanish>Francés</Spanish>
		<Polish>Francuski</Polish>
		<Russian>Французкий</Russian>
	</TEXT>
	<TEXT>
		<Tag>TXT_KEY_LANGUAGE_2</Tag>
		<English>German</English>
		<French>Allemand</French>
		<German>Deutsch</German>
		<Italian>Tedesco</Italian>
		<Spanish>Alemán</Spanish>
		<Polish>Niemiecki</Polish>
		<Russian>Немецкий</Russian>
	</TEXT>
	<TEXT>
		<Tag>TXT_KEY_LANGUAGE_3</Tag>
		<English>Italian</English>
		<French>Italien</French>
		<German>Italiano</German>
		<Italian>Italiano</Italian>
		<Spanish>Italiano</Spanish>
		<Polish>W&#179;oski</Polish>
		<Russian>Итальянский</Russian>
	</TEXT>
	<TEXT>
		<Tag>TXT_KEY_LANGUAGE_4</Tag>
		<English>Spanish</English>
		<French>Espagnol</French>
		<German>Español</German>
		<Italian>Spagnolo</Italian>
		<Spanish>Español</Spanish>
		<Polish>Hiszpa&#241;ski</Polish>
		<Russian>Испанский</Russian>
	</TEXT>
	<TEXT>
		<Tag>TXT_KEY_LANGUAGE_5</Tag>
		<English>Polish</English>
		<French>Polonais</French>
		<German>Polnisch</German>
		<Italian>Polacco</Italian>
		<Spanish>Polaco</Spanish>
		<Polish>Polski</Polish>
		<Russian>Польский</Russian>
	</TEXT>
	<TEXT>
		<Tag>TXT_KEY_LANGUAGE_6</Tag>
		<English>Russian</English>
		<French>Russe</French>
		<German>Russisch</German>
		<Italian>Russo</Italian>
		<Spanish>Ruso</Spanish>
		<Polish>Rosyjski</Polish>
		<Russian>Русский</Russian>
	</TEXT>
</Civ4GameText>
